{
  "contractVersion": "0.4-draft",
  "meta": {
    "fixtureKind": "synthetic-operations-demo",
    "mode": "replay",
    "source": "fictional portfolio demonstration",
    "providerData": false,
    "timezone": "America/Phoenix",
    "frameIntervalMs": 10000,
    "geography": "fictional-phoenix-area-overlay",
    "geographicCoordinates": "independently authored fictional street-grid and rail-alignment geometry",
    "replayBehavior": "continuous deterministic loop"
  },
  "routes": [
    {
      "id": "COPPER",
      "label": "Copper 17",
      "mode": "bus",
      "color": "blue",
      "direction": "Desert Vista to Arcadia Exchange",
      "patterns": [
        {
          "id": "COPPER-OUT",
          "directionId": 0,
          "headsign": "Arcadia Exchange",
          "stopIds": [
            "ST-FICTION-01",
            "ST-FICTION-02",
            "ST-FICTION-03"
          ],
          "geometry": {
            "type": "LineString",
            "coordinates": [
              [
                -112.3,
                33.58
              ],
              [
                -112.18,
                33.58
              ],
              [
                -112.18,
                33.54
              ],
              [
                -112.06,
                33.54
              ],
              [
                -112.06,
                33.5
              ],
              [
                -111.94,
                33.5
              ]
            ]
          }
        },
        {
          "id": "COPPER-IN",
          "directionId": 1,
          "headsign": "Desert Vista",
          "stopIds": [
            "ST-FICTION-03",
            "ST-FICTION-02",
            "ST-FICTION-01"
          ],
          "geometry": {
            "type": "LineString",
            "coordinates": [
              [
                -111.94,
                33.5
              ],
              [
                -112.06,
                33.5
              ],
              [
                -112.06,
                33.54
              ],
              [
                -112.18,
                33.54
              ],
              [
                -112.18,
                33.58
              ],
              [
                -112.3,
                33.58
              ]
            ]
          }
        }
      ],
      "displayPatternId": "COPPER-OUT"
    },
    {
      "id": "SKY",
      "label": "Sky 29",
      "mode": "bus",
      "color": "cyan",
      "direction": "West Commons to Mesa Gardens",
      "patterns": [
        {
          "id": "SKY-OUT",
          "directionId": 0,
          "headsign": "Mesa Gardens",
          "stopIds": [
            "ST-FICTION-04",
            "ST-FICTION-05",
            "ST-FICTION-06"
          ],
          "geometry": {
            "type": "LineString",
            "coordinates": [
              [
                -111.9305626,
                33.5194436
              ],
              [
                -111.9304,
                33.5237
              ],
              [
                -111.9426,
                33.52372
              ],
              [
                -111.94265,
                33.53142
              ],
              [
                -112.0125,
                33.5351
              ],
              [
                -112.0345,
                33.53855
              ],
              [
                -112.1515,
                33.53845
              ],
              [
                -112.151531,
                33.523905
              ],
              [
                -112.15155,
                33.4653
              ],
              [
                -112.1688,
                33.4511
              ],
              [
                -112.1785,
                33.4442
              ],
              [
                -112.1815,
                33.393
              ],
              [
                -112.1812,
                33.3929
              ],
              [
                -112.1683178,
                33.3919246
              ],
              [
                -112.1684,
                33.40655
              ],
              [
                -112.10075,
                33.40655
              ],
              [
                -112.1007,
                33.386
              ],
              [
                -112.0995,
                33.3844
              ],
              [
                -112.0745,
                33.3768
              ],
              [
                -112.063,
                33.3773
              ],
              [
                -111.9785,
                33.3868
              ],
              [
                -111.9278,
                33.389
              ],
              [
                -111.92645,
                33.39015
              ],
              [
                -111.9263825,
                33.392977
              ],
              [
                -111.9264,
                33.3855
              ],
              [
                -111.9238,
                33.3862
              ],
              [
                -111.8898,
                33.3935
              ],
              [
                -111.8898,
                33.5091
              ],
              [
                -111.891,
                33.50925
              ],
              [
                -111.9257,
                33.50925
              ],
              [
                -111.9257,
                33.51585
              ],
              [
                -111.9303,
                33.51585
              ],
              [
                -111.9302636,
                33.5192862
              ]
            ]
          }
        },
        {
          "id": "SKY-IN",
          "directionId": 1,
          "headsign": "West Commons",
          "stopIds": [
            "ST-FICTION-06",
            "ST-FICTION-05",
            "ST-FICTION-04"
          ],
          "geometry": {
            "type": "LineString",
            "coordinates": [
              [
                -111.9302636,
                33.5192862
              ],
              [
                -111.9303,
                33.51585
              ],
              [
                -111.9257,
                33.51585
              ],
              [
                -111.9257,
                33.50925
              ],
              [
                -111.891,
                33.50925
              ],
              [
                -111.8898,
                33.5091
              ],
              [
                -111.8898,
                33.3935
              ],
              [
                -111.9238,
                33.3862
              ],
              [
                -111.9264,
                33.3855
              ],
              [
                -111.9263825,
                33.392977
              ],
              [
                -111.92645,
                33.39015
              ],
              [
                -111.9278,
                33.389
              ],
              [
                -111.9785,
                33.3868
              ],
              [
                -112.063,
                33.3773
              ],
              [
                -112.0745,
                33.3768
              ],
              [
                -112.0995,
                33.3844
              ],
              [
                -112.1007,
                33.386
              ],
              [
                -112.10075,
                33.40655
              ],
              [
                -112.1684,
                33.40655
              ],
              [
                -112.1683178,
                33.3919246
              ],
              [
                -112.1812,
                33.3929
              ],
              [
                -112.1815,
                33.393
              ],
              [
                -112.1785,
                33.4442
              ],
              [
                -112.1688,
                33.4511
              ],
              [
                -112.15155,
                33.4653
              ],
              [
                -112.151531,
                33.523905
              ],
              [
                -112.1515,
                33.53845
              ],
              [
                -112.0345,
                33.53855
              ],
              [
                -112.0125,
                33.5351
              ],
              [
                -111.94265,
                33.53142
              ],
              [
                -111.9426,
                33.52372
              ],
              [
                -111.9304,
                33.5237
              ],
              [
                -111.9305626,
                33.5194436
              ]
            ]
          }
        }
      ],
      "displayPatternId": "SKY-OUT"
    },
    {
      "id": "CACTUS",
      "label": "Cactus 60",
      "mode": "bus",
      "color": "cyan",
      "direction": "North Mountain Park to Chandler Market",
      "patterns": [
        {
          "id": "CACTUS-OUT",
          "directionId": 0,
          "headsign": "Chandler Market",
          "stopIds": [
            "ST-FICTION-07",
            "ST-FICTION-08",
            "ST-FICTION-05",
            "ST-FICTION-09"
          ],
          "geometry": {
            "type": "LineString",
            "coordinates": [
              [
                -112.14,
                33.66
              ],
              [
                -112.14,
                33.54
              ],
              [
                -112.1,
                33.54
              ],
              [
                -112.1,
                33.45
              ],
              [
                -112.07,
                33.45
              ],
              [
                -112.07,
                33.34
              ],
              [
                -111.9,
                33.34
              ]